{
  "schema": 1,
  "ok": true,
  "tool": "status",
  "data": {
    "nodes": 0,
    "edges": 0,
    "files": 0,
    "languages": [],
    "last_updated": null,
    "vcs": "git",
    "built_on_branch": null,
    "built_at_commit": null,
    "current_branch": "<redacted>",
    "current_sha": "<redacted>",
    "svn_branch": null,
    "svn_revision": null,
    "stale": false,
    "stale_reason": null,
    "remediation": null
  },
  "truncated": false,
  "provenance": {
    "graph_sha": null,
    "built_at": null
  },
  "size": {
    "chars": 472,
    "tokens_estimated": 118,
    "estimator": "chars/4"
  }
}
